Poste;Entreprise;Ville;Salaire/TJM;Description;Lien;tech_score;salaire_annuel_estime
Data Analyst - Power BI Montpellier;Cherry Pick;France / Remote;450 €⁄j;"En quelques mots Cherry Pick est à la recherche d'un ""Data Analyst - Power BI"" pour un client dans le secteur de l'Energie Description 🎯 Contexte de la mission Dans le cadre de la consolidation et du développement des outils de pilotage métiers , l’entreprise recherche un Data Analyst Power BI confirmé afin de garantir la performance, la fiabilité et l’évolution de ses tableaux de bord stratégiques. L’objectif : assurer la maintenance en condition opérationnelle (MCO) des rapports critiques, développer de nouveaux tableaux Power BI et contribuer à l’amélioration de la qualité des données. ⚙️ Rôle et responsabilités Intégré(e) à l’équipe Data et en lien direct avec les directions métiers, le Data Analyst aura un rôle clé dans la valorisation des données et la fiabilité des indicateurs . Vos missions principales : Assurer le MCO des tableaux Power BI critiques : supervision, rafraîchissement, vérification des sources et résolution d’anomalies. Concevoir et déployer de nouveaux tableaux de bord Power BI répondant aux besoins métiers (performance, ergonomie, fiabilité). Analyser et comprendre les besoins métiers variés, formaliser les règles de gestion et traduire les demandes en solutions concrètes. Identifier les anomalies de données et sensibiliser les métiers à la qualité et à la cohérence des informations. Collaborer avec les équipes techniques (AWS, Dataiku, Power Platform) pour améliorer les flux de données et la gouvernance . Documenter les processus, les évolutions et les incidents afin d’assurer la traçabilité et la continuité des projets. Produire les reportings d’avancement et suivre les demandes dans Jira.";https://www.free-work.com/fr/tech-it/data-analyst/job-mission/data-analyst-power-bi-montpellier;5;99000.0
Data Analyst (H/F);nahange;France / Remote;310-450 €⁄j;Collecte, Traitement de données avec analyse, nettoyage, complétion, correction, uniformisation Proposition et mise en œuvre d’outils et d’algorithmes de traitement de données Modèles avancés pour des analyses prédictives précises Mise en oeuvre des tableaux de bord pour visualisation des métiers Maitrise modélisation objet UML Maîtrise langage SQL, Python, R, Visual Studio Code et EXCEL skills for Data analyst (Power query, Pivot tables, Power Pivot) Exploration et requêtage des différents types de bases de données;https://www.free-work.com/fr/tech-it/data-analyst/job-mission/data-analyst-h-f-428;5;83600.0
Data analyst confirmé marketing client;ANDEMA;Lille, Hauts-de-France;350-400 €⁄j;Contexte de la mission : Dans le cadre du renforcement de notre département IT Data, nous recherchons un(e) Data Analyst Confirmé(e) pour accompagner les équipes Marketing, CRM et Digital dans l'exploitation et l'analyse des données clients. L'objectif : améliorer la connaissance client, affiner la segmentation, et optimiser les actions marketing grâce à une analyse fine des comportements et parcours clients. Activités et responsabilités de la mission - Analyser les données clients pour identifier des comportements, profils et tendances de consommation. - Construire et maintenir des segmentation clients pertinentes (RFM, appétence, valeur client, cycle de vie.). - Réaliser des analyses ad hoc pour répondre aux besoins des équipes Marketing, CRM, Digital, Produit. - Mettre en place des tableaux de bord Power BI pour suivre les KPIs liés à l'acquisition, l'activation, la fidélisation, et la rétention client. - Collaborer avec les équipes Data Engineering pour la préparation et modélisation des données dans l'environnement Snowflake. - Identifier des opportunités business via des analyses prédictives ou des insights data-driven. - Contribuer à la qualité et cohérence des données clients, en lien avec les équipes IT et Data Governance. Résultats attendus - Mise en place de profils clients exploitables par les équipes métier. - Amélioration de la performance des campagnes marketing grâce à une segmentation plus fine. - Accroissement de la connaissance client et des insights comportementaux. - Mise en place de tableaux de bord dynamiques et accessibles, facilitant la prise de décision. Démarrage : rapide Localisation : métropolie lilloise (1j de télétravail par semaine non négociable);https://www.free-work.com/fr/tech-it/responsable-directeur-marketing-online-cmo/job-mission/data-analyst-confirme-marketing-client-1;5;82500.0
‼️URGENT ‼️ 2x Data Analyst Power BI – Industrie ‼️;Groupe Aptenia;Strasbourg, Grand Est;360 €⁄j;🔍 Nous recherchons deux Data Analysts Power BI pour renforcer une équipe projet dans l’industrie. La mission est de longue durée. 📍 Strasbourg (sur site obligatoire) 📅 Démarrages : 1 ASAP + 1 en janvier 🎯 Missions : ✅ Création & optimisation de dashboards Power BI ✅ Analyse et traitement de données (Python, SQL) ✅ Contribution aux workflows Git CI/CD ✅ Échanges réguliers avec les métiers pour comprendre les besoins 👉 3 à 4 ans d’expérience en Data Analysis 👉 À l’aise en environnement industriel 👉 Force de proposition et autonomie;https://www.free-work.com/fr/tech-it/data-analyst/job-mission/urgent-2x-data-analyst-power-bi-industrie;5;79200.0
Profil Data (Data Analyst ou Data Scientist);MLMCONSEIL;Paris, France;100-500 €⁄j;Pour le besoi de mon client ,je suis à la recherche d’ un profil expérimenté, autonome, avec des compétences DATA forte (Data analyst ou Data scientist senior) Analyser les parcours d’achat des usagers et leurs besoins dans différents types de gares. Construire une planification fiable des besoins en canaux de distribution à horizon 2027 à partir d’un modèle dynamique. Faire évoluer ce modèle vers un outil d’anticipation permettant de projeter les besoins par gare à moyen terme. Compétences attendues : maîtrise de Python, SQL, Excel et Power BI.;https://www.free-work.com/fr/tech-it/data-scientist/job-mission/profil-data-data-analyst-ou-data-scientist;5;66000.0
Data Analyst;BUBBLE GO;Paris, France;N/C;En tant que Data Analyst au sein de la division e-banking d’une des principales institutions financières européennes, vous serez chargé·e de transformer des données complexes en insights exploitables, afin d’orienter les décisions stratégiques et l’innovation dans la banque digitale. Vous travaillerez en étroite collaboration avec des équipes pluridisciplinaires, en exploitant des outils analytiques avancés pour améliorer l’expérience client, optimiser la performance opérationnelle et soutenir la conformité et la sécurité dans un environnement dynamique et exigeant. Vos missions principales Concevoir, développer et maintenir des tableaux de bord et rapports interactifs pour soutenir l’intelligence décisionnelle. Extraire, transformer et charger (ETL) les données issues de divers systèmes bancaires via SSIS, en garantissant leur qualité et leur cohérence. Réaliser des analyses approfondies sur des bases MSSQL : requêtage, modélisation, nettoyage. Collaborer avec les parties prenantes pour recueillir les besoins métier et les traduire en solutions techniques. Surveiller et évaluer les flux de données, résoudre les problèmes et proposer des améliorations. Documenter les processus, standards et méthodologies pour assurer la transparence et la reproductibilité. Réaliser des analyses ponctuelles pour soutenir la conformité réglementaire, la gestion des risques et le développement produit. Participer à la migration et à l’intégration de systèmes legacy vers des plateformes analytiques modernes.;https://www.free-work.com/fr/tech-it/data-analyst/job-mission/data-analyst-738;5;0.0
DATA Analyst SIG - GPS;Cherry Pick;Paris, France;550-580 €⁄j;"En quelques mots Cherry Pick est à la recherche d'un ""DATA Analyst SIG - GPS"" pour un client dans le secteur Public Description Data Analyst SIG – Expert Données GPS & Mobilité (H/F) Technologie clé : Databricks / Python / SQL Spatial Niveau : Expérimenté / Confirmé 🌐 Le Contexte Nous recherchons pour notre client, acteur majeur dans le secteur de la Mobilité/Logistique , un Data Analyst confirmé possédant une expertise pointue en Géomatique (SIG) . Vous rejoignez une équipe Data où la dimension spatiale est critique. Votre rôle ne sera pas simplement d'analyser des chiffres, mais de faire ""parler"" des millions de points GPS bruts pour reconstituer des parcours, optimiser des tournées et comprendre la réalité terrain des déplacements. 🎯 Votre Mission : Dompter la donnée GPS Vous êtes le référent sur le traitement et la valorisation des données de géolocalisation. Vous transformez une donnée brute, souvent bruitée, en informations métier fiables (arrêts, trajets, adresses). Vos défis techniques & fonctionnels : Qualité & Nettoyage de la donnée GPS : Détection et correction des points aberrants (outliers). Traitement du bruit GPS et lissage des trajectoires. Map Matching & Rapprochement Voirie : Projeter les points GPS bruts sur le filaire de voirie (snapping) pour reconstituer le trajet réel emprunté. Gérer les cas complexes (tunnels, zones urbaines denses, ""canyons urbains""). Analyse des Arrêts & Adresses : Identifier les arrêts logistiques vs les arrêts de circulation (feux, bouchons). Réconcilier les positions d'arrêt avec les adresses distribuées (Geocoding / Reverse Geocoding précis). Détecter les changements de moyens de locomotion (multimodalité). Analyse Comportementale & Temporelle : Comparer les parcours réalisés entre différentes journées (analyse de régularité, détection d'anomalies de parcours). Calculer des indicateurs de performance spatiaux (ETA, temps de trajet réel vs théorique).";https://www.free-work.com/fr/tech-it/data-analyst/job-mission/data-analyst-sig-gps;4;124300.0
Data Analyst - Infogérance - Lille (H/F);EASY PARTNER;Lille, Hauts-de-France;500-550 €⁄j;Rejoignez l'une des entreprises leaders dans l'optimisation et la transformation digitale au sein du secteur des services numériques. Basée à Lille et rayonnant sur tout le territoire français, notre entreprise s'engage à offrir des solutions innovantes à ses clients afin de les accompagner dans leur évolution. Face à une croissance constante et à une demande accrue pour des analyses de données précises et transformantes, nous recherchons activement un(e) Data Analyst pour renforcer notre pôle Data. Vous travaillerez étroitement avec les métiers pour transcrire leurs besoins en solutions data-driven, assurant la qualité et la pertinence des insights. Missions - Élaborer le cadrage fonctionnel des cas d’usage avec les différents métiers de l'entreprise. - Traduire des besoins métier en datasets, KPIs et tableaux de bord efficaces. - Réaliser des explorations approfondies de données avec un fort accent sur le storytelling. - Assurer la documentation et la qualité des données. - Contribuer à la mise en œuvre des cas d’usage sur Power BI / Fabric en tant que data consommateur. - Fournir un support aux POC/expérimentations IA en collaboration avec les Data Engineers.;https://www.free-work.com/fr/tech-it/data-analyst/job-mission/data-analyst-infogerance-lille-h-f;4;115500.0
Data Analyst Dataiku/Tableau/SAS;OBJECTWARE;France / Remote;400-550 €⁄j;Objectif de la mission Au sein du Pole Data & Analytics, dans l’équipe Data Monitoring Réseaux, dont la fonction principale est de délivrer les reportings et les Dashboard pour le réseau d’agence, nous étoffons notre équipe de data Analysts pour répondre aux demandes du Plan Stratégique 2026-2030. Prestations demandées Les missions sont : - Analyse, création, évolution et modification des traitements de données (création d'indicateurs & des codes références) - Uniformisation technique des processus de traitement de données - Supervision du bon déploiement des nouveaux processus de traitement - Vérification de la bonne intégration des données et de leurs référencements (mise à jour des glossaires associés) - Mise en place, maintenance et test des jeux de données - Automatisation des programmes avec DataIku - Prise en charge à la réalisation de la Visualisation avec Tableau (Desktop / Serveur) La maitrise de DataIku et de SQL sont indispensables. La maitrise de Tableau et SAS seraient de vrais plus.;https://www.free-work.com/fr/tech-it/consultant-decisionnel-bi-powerbi-sas-tableau/job-mission/data-analyst-dataiku-tableau-sas-1;4;104500.0
Data Analyst orienté Cybersécurité & Reporting (H/F);AVA2I;France / Remote;400-550 €⁄j;Nous recrutons : Data Analyst orienté Cybersécurité & Reporting Nous recherchons un profil DATA et REPORTING spécialisé dans l’univers Cyber et IAM pour renforcer nos équipes. Missions principales : Production, suivi et automatisation des KPI/KRI Cyber & IAM Industrialisation de dashboards (Power BI / SQL / Python) Contrôles de qualité de données et fiabilisation des référentiels Définition des indicateurs et challenge des besoins métiers Collaboration transverse entre les équipes Data, Cyber et Risques Analyse de données : habilitations, logs, référentiels IAM Profil recherché : Un Data Analyst spécialisé en cybersécurité, capable de comprendre les enjeux Cyber & IAM sans être un expert applicatif IAM. Rigueur, sens de l’analyse et capacité à manipuler la donnée à grande échelle sont essentiels.;https://www.free-work.com/fr/tech-it/consultant-cyber-securite/job-mission/data-analyst-oriente-cybersecurite-reporting-h-f;4;104500.0
Data Analyst / Expert PowerBI Senior (F/H);Savane Consulting;France / Remote;400-550 €⁄j;Data Analyst / Expert PowerBI - Freelance - Moissy-Cramayel - 400-550€/jour Contexte : Nous recherchons un Data Analyst Power BI pour une mission d’environ trois mois et demi. L’objectif est de développer et d’améliorer plusieurs outils de pilotage et d’analyse de données dans un contexte industriel complexe. Missions : Concevoir et mettre à jour des tableaux de bord Power BI à partir de données issues de différents systèmes internes. Structurer, fiabiliser et analyser des volumes importants de données afin d’identifier des tendances, alertes et axes d’amélioration. Mettre en place des courbes d’évolution, simulations et indicateurs personnalisés. Reprendre et corriger des tableaux de bord existants afin d’assurer la cohérence entre données sources et résultats affichés. Préparer des livrables clairs et documentés pour faciliter l’exploitation et la maintenance des outils développés. Collaborer avec les équipes métiers pour comprendre les besoins, recueillir les retours et ajuster les outils en conséquence. Compétences requises : Maîtrise avancée de Power BI : modélisation de données, mesures, visuels, automatisation, gestion de filtres. Solide expérience en traitement et structuration de données multidimensionnelles. Capacité à analyser des données techniques, détecter des signaux faibles et produire des indicateurs pertinents. Aisance dans la mise en forme de rapports et la présentation de résultats. Rigueur, autonomie, sens du détail et capacité à travailler avec des interlocuteurs variés.;https://www.free-work.com/fr/tech-it/consultant-decisionnel-bi-powerbi-sas-tableau/job-mission/data-analyst-expert-powerbi-senior-f-h;4;104500.0
Un(e) Data Analyste - Maintenance évolutive d'une application de reporting;EXMC;France / Remote;400-480 €⁄j;Data Analyste Expert - Maintenance évolutive d'une application de reporting Contexte : Nous recherchons pour un(e) consultant(e) Data Analyste BI confirmé(e) pour assurer la maintenance évolutive et contribuer à l'amélioration continue d'une application de reporting interne dédiée au suivi commercial. Cette application joue un rôle clé en collectant des données stratégiques et en les mettant à disposition des utilisateurs internes afin de suivre et analyser la performance commerciale. Missions : En tant que Data Analyste confirmé, vous serez chargé(e) de la gestion opérationnelle de l’application de reporting et participerez activement à un projet stratégique visant à optimiser le processus de collecte et de mise à jour des données. Ce projet a pour objectif de simplifier les flux de données, réduire au minimum les traitements manuels, et accélérer le cycle de mise à jour des informations tout en garantissant une qualité de données irréprochable. Plus spécifiquement, vous serez amené(e) à : • Assurer la maintenance évolutive de l'application existante, en veillant à son bon fonctionnement et à l’intégration des évolutions nécessaires pour répondre aux besoins internes. • Contribuer à l'amélioration du processus de reporting en travaillant sur l’automatisation de la collecte de données et l'optimisation des traitements, afin de simplifier le processus tout en préservant la fiabilité et la précision des données. • Collaborer avec l’équipe interne pour définir les besoins fonctionnels et techniques, et pour déployer des solutions adaptées à l’amélioration de l'analyse de la performance commerciale. • Apporter une expertise technique et fonctionnelle pour l’optimisation des outils de reporting et pour le développement de nouvelles fonctionnalités. • Prendre en charge la maintenance des solutions déployées en apportant des améliorations continues et en veillant à leur adéquation avec les exigences métiers. • Effectuer une analyse détaillée des données afin d’identifier des axes d’amélioration dans les processus existants et proposer des solutions efficaces et adaptées aux enjeux commerciaux de l’entreprise. • Assistance aux utilisateurs en faisant preuve de pédagogie pour les autonomiser. Aide à la gestion du changement. Compétences techniques et linguistiques requises Profil recherché : • Expertise confirmée en Business Intelligence, avec une maîtrise des outils d’extraction et de traitement de données, et des technologies associées. • Maitrise de l’utilisation de SQL pour sélectionner des données • Compétences solides en analyse de données, avec une capacité à traduire des besoins métiers en solutions techniques. • La connaissance d’outils de reporting serait un plus. • Capacité à travailler de manière autonome et en équipe. • Rigueur et souci de la qualité des données, avec une forte orientation résultats. Les solutions BI mise en œuvre actuellement chez le client sont basées sur les technologies suivantes : • Oracle • IBM Datastage • Power BI • SAP Business Object 4.2 • Outil de data virtualization comme Denodo • Sqlserver Compétences requises • Une expérience significative d’un minima de 4 années dans l’intégration de systèmes décisionnels • Une expertise concrète en environnement BI • De solides connaissances ainsi qu’une expérience significative dans la manipulation de données. • Des compétences fonctionnelles • Un fort sens de l’analyse et de la pro activité • Capacité rédactionnelle • Excellent relationnel • Maîtrise de l’anglais indispensable (lu, parlé, écrit) Autres compétences appréciées • Connaissance du métier de l’assurance Durée de la Prestation Régie, pour une période de 6 mois renouvelable.;https://www.free-work.com/fr/tech-it/administrateur-applicatif-erp-crm-sirh/job-mission/un-e-data-analyste-maintenance-evolutive-dune-application-de-reporting;4;96800.0
Data Analyst Informatica;Trait d'Union Consulting;Strasbourg, Grand Est;300-460 €⁄j;Au sein d’un grand groupe industriel international spécialisé dans les solutions électriques, vous intégrerez le pôle Data rattaché à la DSI. L’équipe Data Quality, composée de 4 personnes, a pour mission de garantir la fiabilité et la cohérence des données (Customer, RH, Produit, etc.) dans un contexte multiculturel. L’enjeu est d’assurer la mise à disposition de données fiables, exploitables et de haute qualité au service des équipes métiers et des partenaires distributeurs. Missions qui vous serez conférés : Assurer la qualité, la cohérence et la complétude des données sur l’ensemble des périmètres (client, RH, produit…). Mettre en œuvre et superviser les processus ETL avec l’outil Informatica , validé comme solution principale au sein du pôle Data. Collaborer avec les équipes métiers pour recueillir, analyser et formaliser les besoins en matière de données. Organiser et animer des ateliers métiers afin de traduire les besoins fonctionnels en spécifications techniques. Participer aux projets d’ AMOA Data : rédaction des spécifications, accompagnement des utilisateurs, suivi de la mise en production. Contribuer à la modélisation et à la gouvernance des données , dans une logique d’amélioration continue. Créer et maintenir des rapports et tableaux de bord dans Power BI.;https://www.free-work.com/fr/tech-it/data-analyst/job-mission/data-analyst-informatica-2;4;83600.0
Data Analyst Informatica;Trait d'Union Consulting;Strasbourg, Grand Est;300-450 €⁄j;Au sein d’un grand groupe industriel international spécialisé dans les solutions électriques, vous intégrerez le pôle Data rattaché à la DSI. L’équipe Data Quality, composée de 4 personnes, a pour mission de garantir la fiabilité et la cohérence des données (Customer, RH, Produit, etc.) dans un contexte multiculturel. L’enjeu est d’assurer la mise à disposition de données fiables, exploitables et de haute qualité au service des équipes métiers et des partenaires distributeurs. Missions qui vous serez conférés : Assurer la qualité, la cohérence et la complétude des données sur l’ensemble des périmètres (client, RH, produit…). Mettre en œuvre et superviser les processus ETL avec l’outil Informatica , validé comme solution principale au sein du pôle Data. Collaborer avec les équipes métiers pour recueillir, analyser et formaliser les besoins en matière de données. Organiser et animer des ateliers métiers afin de traduire les besoins fonctionnels en spécifications techniques. Participer aux projets d’ AMOA Data : rédaction des spécifications, accompagnement des utilisateurs, suivi de la mise en production. Contribuer à la modélisation et à la gouvernance des données , dans une logique d’amélioration continue. Créer et maintenir des rapports et tableaux de bord dans Power BI.;https://www.free-work.com/fr/tech-it/data-analyst/job-mission/data-analyst-informatica-1;4;82500.0
Data Analyst;OBJECTWARE;France / Remote;250-280 €⁄j;Objectifs de la mission Dans le cadre d’activités de pilotage et d’analyse, nous recherchons un Chargé d’Études Statistiques maîtrisant SAS afin de réaliser des travaux d’extraction, de contrôle qualité, d’analyse et de restitution auprès des équipes métier. Livrables attendus Jeux de données fiables issus des extractions SAS Rapports d’analyses Contrôles de cohérence et de qualité des données Tableaux de bord de pilotage Notes de synthèse et documents de restitution Recommandations sur l’amélioration des processus Missions Réaliser des extractions de données via SAS Manipuler, structurer et nettoyer les données Effectuer les contrôles qualité sur les données produites Analyser les résultats et produire les indicateurs de pilotage Rédiger et présenter les analyses aux équipes métier Contribuer à la fiabilisation des référentiels data Échanger avec les équipes métier pour comprendre les besoins et restituer les résultats Profil recherché Bac +3 à Bac +5 en statistiques, mathématiques appliquées, data analysis ou domaine équivalent Expérience confirmée en tant que Chargé d’Études Statistiques, Data Analyst ou équivalent Maîtrise de SAS (SAS Base, Macro) Aisance dans la manipulation de données volumineuses Capacité d’analyse et de synthèse Bon relationnel et capacité à interagir avec les équipes métier Rigueur, autonomie, sens du contrôle et de la qualité des données Compétences techniques SAS Base / SAS Enterprise Guide SQL apprécié Connaissances en qualité de données et data management appréciées Connaissance du secteur assurance est un plus Soft skills Rigueur Autonomie Communication claire Travail en équipe Capacité d’adaptation;https://www.free-work.com/fr/tech-it/data-analyst/job-mission/data-analyst-744;4;58300.0
Data Analyst;Nicholson SAS;Nantes, Pays de la Loire;250 €⁄j;Compétences techniques indispensables : Maîtrise de SQL et Dataiku (indispensable). Bonne connaissance des environnements Big Data (type Data Lake, Hive, Impala, Spark…). Maitrise des bases du web marketing Connaissance des outils de dataviz : Digdash, Qlik Sense, Power BI, etc. Maîtrise de Piano Analytics ou d’un outil équivalent de web analytics est un plus. Compréhension des enjeux liés à la qualité, à la structuration et à la gouvernance de la donnée. Compétences fonctionnelles : Capacité à analyser, synthétiser et vulgariser des résultats complexes. Sens de la rigueur, de l’autonomie et de la curiosité. Excellentes aptitudes à travailler en équipe et à interagir avec des interlocuteurs variés (techniques et métiers).;https://www.free-work.com/fr/tech-it/data-analyst/job-mission/data-analyst-734;4;55000.0
